Award,Winner,Film
Actor in a Leading Role,1.0,Capote
Actor in a Leading Role,,Hustle & Flow
Actor in a Leading Role,,Brokeback Mountain
Actor in a Leading Role,,Walk the Line
Actor in a Leading Role,,"Good Night, and Good Luck."
Actor in a Supporting Role,1.0,Syriana
Actor in a Supporting Role,,Crash
Actor in a Supporting Role,,Cinderella Man
Actor in a Supporting Role,,Brokeback Mountain
Actor in a Supporting Role,,A History of Violence
Actress in a Leading Role,,Mrs. Henderson Presents
Actress in a Leading Role,,Transamerica
Actress in a Leading Role,,Pride & Prejudice
Actress in a Leading Role,,North Country
Actress in a Leading Role,1.0,Walk the Line
Actress in a Supporting Role,,Junebug
Actress in a Supporting Role,,Capote
Actress in a Supporting Role,,North Country
Actress in a Supporting Role,1.0,The Constant Gardener
Actress in a Supporting Role,,Brokeback Mountain
Animated Feature Film,,Hayao Miyazaki
Animated Feature Film,,Mike Johnson and Tim Burton
Animated Feature Film,1.0,Nick Park and Steve Box
Art Direction,,Art Direction: Jim Bissell; Set Decoration: Jan Pascale
Art Direction,,Art Direction: Stuart Craig; Set Decoration: Stephenie McMillan
Art Direction,,Art Direction: Grant Major; Set Decoration: Dan Hennah and Simon Bright
Art Direction,1.0,Art Direction: John Myhre; Set Decoration: Gretchen Rau
Art Direction,,Art Direction: Sarah Greenwood; Set Decoration: Katie Spencer
Cinematography,,Wally Pfister
Cinematography,,Rodrigo Prieto
Cinematography,,Robert Elswit
Cinematography,1.0,Dion Beebe
Cinematography,,Emmanuel Lubezki
Costume Design,,Gabriella Pescucci
Costume Design,1.0,Colleen Atwood
Costume Design,,Sandy Powell
Costume Design,,Jacqueline Durran
Costume Design,,Arianne Phillips
Directing,1.0,Ang Lee
Directing,,Bennett Miller
Directing,,Paul Haggis
Directing,,George Clooney
Directing,,Steven Spielberg
Documentary (Feature),,Hubert Sauper
Documentary (Feature),,Alex Gibney and Jason Kliot
Documentary (Feature),1.0,Luc Jacquet and Yves Darondeau
Documentary (Feature),,Henry-Alex Rubin and Dana Adam Shapiro
Documentary (Feature),,Marshall Curry
Documentary (Short Subject),,Dan Krauss
Documentary (Short Subject),,Kimberlee Acquaro and Stacy Sherman
Documentary (Short Subject),,Steven Okazaki
Documentary (Short Subject),1.0,Corinne Marrinan and Eric Simonson
Film Editing,,Mike Hill and Dan Hanley
Film Editing,,Claire Simpson
Film Editing,1.0,Hughes Winborne
Film Editing,,Michael Kahn
Film Editing,,Michael McCusker
Foreign Language Film,,Italy
Foreign Language Film,,France
Foreign Language Film,,The Palestinian Territories
Foreign Language Film,,Germany
Foreign Language Film,1.0,South Africa
Makeup,1.0,Howard Berger and Tami Lane
Makeup,,David Leroy Anderson and Lance Anderson
Makeup,,Dave Elsey and Nikki Gooley
Music (Original Score),1.0,Gustavo Santaolalla
Music (Original Score),,Alberto Iglesias
Music (Original Score),,John Williams
Music (Original Score),,John Williams
Music (Original Score),,Dario Marianelli
Music (Original Song),,Music by Kathleen Bird York and Michael Becker; Lyric by Kathleen Bird York
Music (Original Song),1.0,"Music and Lyric by Jordan Houston, Cedric Coleman and Paul Beauregard"
Music (Original Song),,Music and Lyric by Dolly Parton
Best Picture,,"Diana Ossana and James Schamus, Producers"
Best Picture,,"Caroline Baron, William Vince and Michael Ohoven, Producers"
Best Picture,1.0,"Paul Haggis and Cathy Schulman, Producers"
Best Picture,,"Grant Heslov, Producer"
Best Picture,,"Kathleen Kennedy, Steven Spielberg and Barry Mendel, Producers"
Short Film (Animated),,Sharon Colman
Short Film (Animated),1.0,John Canemaker and Peggy Stern
Short Film (Animated),,Anthony Lucas
Short Film (Animated),,Shane Acker
Short Film (Animated),,Andrew Jimenez and Mark Andrews
Short Film (Live Action),,Ulrike Grote
Short Film (Live Action),,Sean Ellis and Lene Bausager
Short Film (Live Action),,Rúnar Rúnarsson and Thor S. Sigurjónsson
Short Film (Live Action),,Rob Pearlstein and Pia Clemente
Short Film (Live Action),1.0,Martin McDonagh
Sound Editing,1.0,Mike Hopkins and Ethan Van der Ryn
Sound Editing,,Wylie Stateman
Sound Editing,,Richard King
Sound Mixing,,"Terry Porter, Dean A. Zupancic and Tony Johnson"
Sound Mixing,1.0,"Christopher Boyes, Michael Semanick, Michael Hedges and Hammond Peek"
Sound Mixing,,"Kevin O'Connell, Greg P. Russell, Rick Kline and John Pritchett"
Sound Mixing,,"Paul Massey, D.M. Hemphill and Peter F. Kurland"
Sound Mixing,,"Andy Nelson, Anna Behlmer and Ronald Judkins"
Visual Effects,,"Dean Wright, Bill Westenhofer, Jim Berney and Scott Farrar"
Visual Effects,1.0,"Joe Letteri, Brian Van't Hul, Christian Rivers and Richard Taylor"
Visual Effects,,"Dennis Muren, Pablo Helman, Randal M. Dutra and Daniel Sudick"
Writing (Adapted Screenplay),1.0,Screenplay by Larry McMurtry & Diana Ossana
Writing (Adapted Screenplay),,Screenplay by Dan Futterman
Writing (Adapted Screenplay),,Screenplay by Jeffrey Caine
Writing (Adapted Screenplay),,Screenplay by Josh Olson
Writing (Adapted Screenplay),,Screenplay by Tony Kushner and Eric Roth
Writing (Original Screenplay),1.0,Screenplay by Paul Haggis & Bobby Moresco; Story by Paul Haggis
Writing (Original Screenplay),,Screenplay by George Clooney & Grant Heslov
Writing (Original Screenplay),,Written by Woody Allen
Writing (Original Screenplay),,Written by Noah Baumbach
Writing (Original Screenplay),,Written by Stephen Gaghan
Honorary Award,1.0,
Gordon E. Sawyer Award,1.0,
John A. Bonner Medal of Commendation,1.0,
Actor in a Leading Role,,Blood Diamond
Actor in a Leading Role,,Half Nelson
Actor in a Leading Role,,Venus
Actor in a Leading Role,,The Pursuit of Happyness
Actor in a Leading Role,1.0,The Last King of Scotland
Actor in a Supporting Role,1.0,Little Miss Sunshine
Actor in a Supporting Role,,Little Children
Actor in a Supporting Role,,Blood Diamond
Actor in a Supporting Role,,Dreamgirls
Actor in a Supporting Role,,The Departed
Actress in a Leading Role,,Volver
Actress in a Leading Role,,Notes on a Scandal
Actress in a Leading Role,1.0,The Queen
Actress in a Leading Role,,The Devil Wears Prada
Actress in a Leading Role,,Little Children
Actress in a Supporting Role,,Babel
Actress in a Supporting Role,,Notes on a Scandal
Actress in a Supporting Role,,Little Miss Sunshine
Actress in a Supporting Role,1.0,Dreamgirls
Actress in a Supporting Role,,Babel
Animated Feature Film,,John Lasseter
Animated Feature Film,1.0,George Miller
Animated Feature Film,,Gil Kenan
Art Direction,,Art Direction: John Myhre; Set Decoration: Nancy Haigh
Art Direction,,Art Direction: Jeannine Oppewall; Set Decoration: Gretchen Rau and Leslie E. Rollins
Art Direction,1.0,Art Direction: Eugenio Caballero; Set Decoration: Pilar Revuelta
Art Direction,,Art Direction: Rick Heinrichs; Set Decoration: Cheryl Carasik
Art Direction,,Art Direction: Nathan Crowley; Set Decoration: Julie Ochipinti
Cinematography,,Vilmos Zsigmond
Cinematography,,Emmanuel Lubezki
Cinematography,,Dick Pope
Cinematography,1.0,Guillermo Navarro
Cinematography,,Wally Pfister
Costume Design,,Yee Chung Man
Costume Design,,Patricia Field
Costume Design,,Sharen Davis
Costume Design,1.0,Milena Canonero
Costume Design,,Consolata Boyle
Directing,,Alejandro González Iñárritu
Directing,1.0,Martin Scorsese
Directing,,Clint Eastwood
Directing,,Stephen Frears
Directing,,Paul Greengrass
Documentary (Feature),,Amy Berg and Frank Donner
Documentary (Feature),1.0,Davis Guggenheim
Documentary (Feature),,James Longley and John Sinno
Documentary (Feature),,Heidi Ewing and Rachel Grady
Documentary (Feature),,Laura Poitras and Jocelyn Glatzer
Documentary (Short Subject),1.0,Ruby Yang and Thomas Lennon
Documentary (Short Subject),,Leslie Iwerks and Mike Glad
Documentary (Short Subject),,Karen Goodman and Kirk Simon
Documentary (Short Subject),,Nathaniel Kahn and Susan Rose Behr
Film Editing,,Stephen Mirrione and Douglas Crise
Film Editing,,Steven Rosenblum
Film Editing,,Alex Rodríguez and Alfonso Cuarón
Film Editing,1.0,Thelma Schoonmaker
Film Editing,,"Clare Douglas, Christopher Rouse and Richard Pearson"
Foreign Language Film,,Denmark
Foreign Language Film,,Algeria
Foreign Language Film,1.0,Germany
Foreign Language Film,,Mexico
Foreign Language Film,,Canada
Makeup,,Aldo Signoretti and Vittorio Sodano
Makeup,,Kazuhiro Tsuji and Bill Corso
Makeup,1.0,David Martí and Montse Ribé
Music (Original Score),1.0,Gustavo Santaolalla
Music (Original Score),,Thomas Newman
Music (Original Score),,Philip Glass
Music (Original Score),,Javier Navarrete
Music (Original Score),,Alexandre Desplat
Music (Original Song),1.0,Music and Lyric by Melissa Etheridge
Music (Original Song),,Music by Henry Krieger and Scott Cutler; Lyric by Anne Preven
Music (Original Song),,Music by Henry Krieger; Lyric by Siedah Garrett
Music (Original Song),,Music and Lyric by Randy Newman
Music (Original Song),,Music by Henry Krieger; Lyric by Willie Reale
Best Picture,,"Alejandro González Iñárritu, Jon Kilik and Steve Golin, Producers"
Best Picture,1.0,"Graham King, Producer"
Best Picture,,"Clint Eastwood, Steven Spielberg and Robert Lorenz, Producers"
Best Picture,,"David T. Friendly, Peter Saraf and Marc Turtletaub, Producers"
Best Picture,,"Andy Harries, Christine Langan and Tracey Seaward, Producers"
Short Film (Animated),1.0,Torill Kove
Short Film (Animated),,Gary Rydstrom
Short Film (Animated),,Roger Allers and Don Hahn
Short Film (Animated),,Géza M. Tóth
Short Film (Animated),,Chris Renaud and Michael Thurmeier
Short Film (Live Action),,Javier Fesser and Luis Manso
Short Film (Live Action),,Borja Cobeaga
Short Film (Live Action),,Søren Pilmark and Kim Magnusson
Short Film (Live Action),,Peter Templeman and Stuart Parkyn
Short Film (Live Action),1.0,Ari Sandel
Sound Editing,,Sean McCormack and Kami Asgar
Sound Editing,,Lon Bender
Sound Editing,,Alan Robert Murray and Bub Asman
Sound Editing,1.0,Alan Robert Murray and Bub Asman
Sound Editing,,Christopher Boyes and George Watters II
Sound Mixing,,"Kevin O'Connell, Greg P. Russell and Fernando Cámara"
Sound Mixing,,"Andy Nelson, Anna Behlmer and Ivan Sharrock"
Sound Mixing,1.0,"Michael Minkler, Bob Beemer and Willie Burton"
Sound Mixing,,"John Reitz, Dave Campbell, Gregg Rudloff and Walt Martin"
Sound Mixing,,"Paul Massey, Christopher Boyes and Lee Orloff"
Visual Effects,1.0,"John Knoll, Hal Hickel, Charles Gibson and Allen Hall"
Visual Effects,,"Boyd Shermis, Kim Libreri, Chas Jarrett and John Frazier"
Visual Effects,,"Mark Stetson, Neil Corbould, Richard R. Hoover and Jon Thum"
Writing (Adapted Screenplay),,Screenplay by Sacha Baron Cohen & Anthony Hines & Peter Baynham & Dan Mazer; Story by Sacha Baron Cohen & Peter Baynham & Anthony Hines & Todd Phillips
Writing (Adapted Screenplay),,Screenplay by Alfonso Cuarón & Timothy J. Sexton and David Arata and Mark Fergus & Hawk Ostby
Writing (Adapted Screenplay),1.0,Screenplay by William Monahan
Writing (Adapted Screenplay),,Screenplay by Todd Field & Tom Perrotta
Writing (Adapted Screenplay),,Screenplay by Patrick Marber
Writing (Original Screenplay),,Written by Guillermo Arriaga
Writing (Original Screenplay),,Screenplay by Iris Yamashita; Story by Iris Yamashita & Paul Haggis
Writing (Original Screenplay),1.0,Written by Michael Arndt
Writing (Original Screenplay),,Written by Guillermo del Toro
Writing (Original Screenplay),,Written by Peter Morgan
Jean Hersholt Humanitarian Award,1.0,
Honorary Award,1.0,
Gordon E. Sawyer Award,1.0,
Award of Commendation,1.0,
John A. Bonner Medal of Commendation,1.0,
Actor in a Leading Role,,Michael Clayton
Actor in a Leading Role,1.0,There Will Be Blood
Actor in a Leading Role,,Sweeney Todd The Demon Barber of Fleet Street
Actor in a Leading Role,,In the Valley of Elah
Actor in a Leading Role,,Eastern Promises
Actor in a Supporting Role,,The Assassination of Jesse James by the Coward Robert Ford
Actor in a Supporting Role,1.0,No Country for Old Men
Actor in a Supporting Role,,Charlie Wilson's War
Actor in a Supporting Role,,Into the Wild
Actor in a Supporting Role,,Michael Clayton
Actress in a Leading Role,,Elizabeth: The Golden Age
Actress in a Leading Role,,Away from Her
Actress in a Leading Role,1.0,La Vie en Rose
Actress in a Leading Role,,The Savages
Actress in a Leading Role,,Juno
Actress in a Supporting Role,,I'm Not There
Actress in a Supporting Role,,American Gangster
Actress in a Supporting Role,,Atonement
Actress in a Supporting Role,,Gone Baby Gone
Actress in a Supporting Role,1.0,Michael Clayton
Animated Feature Film,,Marjane Satrapi and Vincent Paronnaud
Animated Feature Film,1.0,Brad Bird
Animated Feature Film,,Ash Brannon and Chris Buck
Art Direction,,Art Direction: Arthur Max; Set Decoration: Beth A. Rubino
Art Direction,,Art Direction: Sarah Greenwood; Set Decoration: Katie Spencer
Art Direction,,Art Direction: Dennis Gassner; Set Decoration: Anna Pinnock
Art Direction,1.0,Art Direction: Dante Ferretti; Set Decoration: Francesca Lo Schiavo
Art Direction,,Art Direction: Jack Fisk; Set Decoration: Jim Erickson
Cinematography,,Roger Deakins
Cinematography,,Seamus McGarvey
Cinematography,,Janusz Kaminski
Cinematography,,Roger Deakins
Cinematography,1.0,Robert Elswit
Costume Design,,Albert Wolsky
Costume Design,,Jacqueline Durran
Costume Design,1.0,Alexandra Byrne
Costume Design,,Marit Allen
Costume Design,,Colleen Atwood
Directing,,Julian Schnabel
Directing,,Jason Reitman
Directing,,Tony Gilroy
Directing,1.0,Joel Coen and Ethan Coen
Directing,,Paul Thomas Anderson
Documentary (Feature),,Charles Ferguson and Audrey Marrs
Documentary (Feature),,Richard E. Robbins
Documentary (Feature),,Michael Moore and Meghan O'Hara
Documentary (Feature),1.0,Alex Gibney and Eva Orner
Documentary (Feature),,Andrea Nix Fine and Sean Fine
Documentary (Short Subject),1.0,Cynthia Wade and Vanessa Roth
Documentary (Short Subject),,Amanda Micheli and Isabel Vega
Documentary (Short Subject),,Tim Sternberg and Francisco Bello
Documentary (Short Subject),,James Longley
Film Editing,1.0,Christopher Rouse
Film Editing,,Juliette Welfling
Film Editing,,Jay Cassidy
Film Editing,,Roderick Jaynes
Film Editing,,Dylan Tichenor
Foreign Language Film,,Israel
Foreign Language Film,1.0,Austria
Foreign Language Film,,Poland
Foreign Language Film,,Kazakhstan
Foreign Language Film,,Russia
Makeup,1.0,Didier Lavergne and Jan Archibald
Makeup,,Rick Baker and Kazuhiro Tsuji
Makeup,,Ve Neill and Martin Samuel
Music (Original Score),1.0,Dario Marianelli
Music (Original Score),,Alberto Iglesias
Music (Original Score),,James Newton Howard
Music (Original Score),,Michael Giacchino
Music (Original Score),,Marco Beltrami
Music (Original Song),1.0,Music and Lyric by Glen Hansard and Marketa Irglova
Music (Original Song),,Music by Alan Menken; Lyric by Stephen Schwartz
Music (Original Song),,"Music and Lyric by Jamal Joseph, Charles Mack and Tevin Thomas"
Music (Original Song),,Music by Alan Menken; Lyric by Stephen Schwartz
Music (Original Song),,Music by Alan Menken; Lyric by Stephen Schwartz
Best Picture,,"Tim Bevan, Eric Fellner and Paul Webster, Producers"
Best Picture,,"Lianne Halfon, Mason Novick and Russell Smith, Producers"
Best Picture,,"Sydney Pollack, Jennifer Fox and Kerry Orent, Producers"
Best Picture,1.0,"Scott Rudin, Ethan Coen and Joel Coen, Producers"
Best Picture,,"JoAnne Sellar, Paul Thomas Anderson and Daniel Lupi, Producers"
Short Film (Animated),,Josh Raskin
Short Film (Animated),,Chris Lavis and Maciek Szczerbowski
Short Film (Animated),,Samuel Tourneux and Simon Vanesse
Short Film (Animated),,Alexander Petrov
Short Film (Animated),1.0,Suzie Templeton and Hugh Welchman
Short Film (Live Action),,Christian E. Christiansen and Louise Vesth
Short Film (Live Action),,Andrea Jublin
Short Film (Live Action),1.0,Philippe Pollet-Villard
Short Film (Live Action),,Guido Thys and Anja Daelemans
Short Film (Live Action),,Daniel Barber and Matthew Brown
Sound Editing,1.0,Karen Baker Landers and Per Hallberg
Sound Editing,,Skip Lievsay
Sound Editing,,Randy Thom and Michael Silvers
Sound Editing,,Christopher Scarabosio and Matthew Wood
Sound Editing,,Ethan Van der Ryn and Mike Hopkins
Sound Mixing,1.0,"Scott Millan, David Parker and Kirk Francis"
Sound Mixing,,"Skip Lievsay, Craig Berkey, Greg Orloff and Peter Kurland"
Sound Mixing,,"Randy Thom, Michael Semanick and Doc Kane"
Sound Mixing,,"Paul Massey, David Giammarco and Jim Stuebe"
Sound Mixing,,"Kevin O'Connell, Greg P. Russell and Peter J. Devlin"
Visual Effects,1.0,"Michael Fink, Bill Westenhofer, Ben Morris and Trevor Wood"
Visual Effects,,"John Knoll, Hal Hickel, Charles Gibson and John Frazier"
Visual Effects,,"Scott Farrar, Scott Benza, Russell Earl and John Frazier"
Writing (Adapted Screenplay),,Screenplay by Christopher Hampton
Writing (Adapted Screenplay),,Written by Sarah Polley
Writing (Adapted Screenplay),,Screenplay by Ronald Harwood
Writing (Adapted Screenplay),1.0,Written for the screen by Joel Coen & Ethan Coen
Writing (Adapted Screenplay),,Written for the Screen by Paul Thomas Anderson
Writing (Original Screenplay),1.0,Written by Diablo Cody
Writing (Original Screenplay),,Written by Nancy Oliver
Writing (Original Screenplay),,Written by Tony Gilroy
Writing (Original Screenplay),,"Screenplay by Brad Bird; Story by Jan Pinkava, Jim Capobianco, Brad Bird"
Writing (Original Screenplay),,Written by Tamara Jenkins
Honorary Award,1.0,
Gordon E. Sawyer Award,1.0,
Award of Commendation,1.0,
John A. Bonner Medal of Commendation,1.0,
Actor in a Leading Role,,The Visitor
Actor in a Leading Role,,Frost/Nixon
Actor in a Leading Role,1.0,Milk
Actor in a Leading Role,,The Curious Case of Benjamin Button
Actor in a Leading Role,,The Wrestler
Actor in a Supporting Role,,Milk
Actor in a Supporting Role,,Tropic Thunder
Actor in a Supporting Role,,Doubt
Actor in a Supporting Role,1.0,The Dark Knight
Actor in a Supporting Role,,Revolutionary Road
Actress in a Leading Role,,Rachel Getting Married
Actress in a Leading Role,,Changeling
Actress in a Leading Role,,Frozen River
Actress in a Leading Role,,Doubt
Actress in a Leading Role,1.0,The Reader
Actress in a Supporting Role,,Doubt
Actress in a Supporting Role,1.0,Vicky Cristina Barcelona
Actress in a Supporting Role,,Doubt
Actress in a Supporting Role,,The Curious Case of Benjamin Button
Actress in a Supporting Role,,The Wrestler
Animated Feature Film,,Chris Williams and Byron Howard
Animated Feature Film,,John Stevenson and Mark Osborne
Animated Feature Film,1.0,Andrew Stanton
Art Direction,,Art Direction: James J. Murakami; Set Decoration: Gary Fettis
Art Direction,1.0,Art Direction: Donald Graham Burt; Set Decoration: Victor J. Zolfo
Art Direction,,Art Direction: Nathan Crowley; Set Decoration: Peter Lando
Art Direction,,Art Direction: Michael Carlin; Set Decoration: Rebecca Alleway
Art Direction,,Art Direction: Kristi Zea; Set Decoration: Debra Schutt
Cinematography,,Tom Stern
Cinematography,,Claudio Miranda
Cinematography,,Wally Pfister
Cinematography,,Chris Menges and Roger Deakins
Cinematography,1.0,Anthony Dod Mantle
Costume Design,,Catherine Martin
Costume Design,,Jacqueline West
Costume Design,1.0,Michael O'Connor
Costume Design,,Danny Glicker
Costume Design,,Albert Wolsky
Directing,,David Fincher
Directing,,Ron Howard
Directing,,Gus Van Sant
Directing,,Stephen Daldry
Directing,1.0,Danny Boyle
Documentary (Feature),,Ellen Kuras and Thavisouk Phrasavath
Documentary (Feature),,Werner Herzog and Henry Kaiser
Documentary (Feature),,Scott Hamilton Kennedy
Documentary (Feature),1.0,James Marsh and Simon Chinn
Documentary (Feature),,Tia Lessin and Carl Deal
Documentary (Short Subject),,Steven Okazaki
Documentary (Short Subject),,Irene Taylor Brodsky and Tom Grant
Documentary (Short Subject),1.0,Megan Mylan
Documentary (Short Subject),,Adam Pertofsky and Margaret Hyde
Film Editing,,Kirk Baxter and Angus Wall
Film Editing,,Lee Smith
Film Editing,,Mike Hill and Dan Hanley
Film Editing,,Elliot Graham
Film Editing,1.0,Chris Dickens
Foreign Language Film,,Germany
Foreign Language Film,,France
Foreign Language Film,1.0,Japan
Foreign Language Film,,Austria
Foreign Language Film,,Israel
Makeup,1.0,Greg Cannom
Makeup,,"John Caglione, Jr. and Conor O'Sullivan"
Makeup,,Mike Elizalde and Thom Floutz
Music (Original Score),,Alexandre Desplat
Music (Original Score),,James Newton Howard
Music (Original Score),,Danny Elfman
Music (Original Score),1.0,A.R. Rahman
Music (Original Score),,Thomas Newman
Music (Original Song),,Music by Peter Gabriel and Thomas Newman; Lyric by Peter Gabriel
Music (Original Song),1.0,Music by A.R. Rahman; Lyric by Gulzar
Music (Original Song),,Music and Lyric by A.R. Rahman and Maya Arulpragasam
Best Picture,,"Kathleen Kennedy, Frank Marshall and Ceán Chaffin, Producers"
Best Picture,,"Brian Grazer, Ron Howard and Eric Fellner, Producers"
Best Picture,,"Dan Jinks and Bruce Cohen, Producers"
Best Picture,,"Anthony Minghella, Sydney Pollack, Donna Gigliotti and Redmond Morris, Producers"
Best Picture,1.0,"Christian Colson, Producer"
Short Film (Animated),1.0,Kunio Kato
Short Film (Animated),,Konstantin Bronzit
Short Film (Animated),,Emud Mokhberi and Thierry Marchand
Short Film (Animated),,Doug Sweetland
Short Film (Animated),,Alan Smith and Adam Foulkes
Short Film (Live Action),,Reto Caffi
Short Film (Live Action),,Elizabeth Marre and Olivier Pont
Short Film (Live Action),,Steph Green and Tamara Anghie
Short Film (Live Action),,Tivi Magnusson and Dorte Høgh
Short Film (Live Action),1.0,Jochen Alexander Freydank
Sound Editing,1.0,Richard King
Sound Editing,,Frank Eulner and Christopher Boyes
Sound Editing,,Glenn Freemantle and Tom Sayers
Sound Editing,,Ben Burtt and Matthew Wood
Sound Editing,,Wylie Stateman
Sound Mixing,,"David Parker, Michael Semanick, Ren Klyce and Mark Weingarten"
Sound Mixing,,"Lora Hirschberg, Gary Rizzo and Ed Novick"
Sound Mixing,1.0,"Ian Tapp, Richard Pryke and Resul Pookutty"
Sound Mixing,,"Tom Myers, Michael Semanick and Ben Burtt"
Sound Mixing,,"Chris Jenkins, Frank A. Montaño and Petr Forejt"
Visual Effects,1.0,"Eric Barba, Steve Preeg, Burt Dalton and Craig Barron"
Visual Effects,,"Nick Davis, Chris Corbould, Tim Webber and Paul Franklin"
Visual Effects,,"John Nelson, Ben Snow, Dan Sudick and Shane Mahan"
Writing (Adapted Screenplay),,Screenplay by Eric Roth; Screen Story by Eric Roth and Robin Swicord
Writing (Adapted Screenplay),,Written by John Patrick Shanley
Writing (Adapted Screenplay),,Screenplay by Peter Morgan
Writing (Adapted Screenplay),,Screenplay by David Hare
Writing (Adapted Screenplay),1.0,Screenplay by Simon Beaufoy
Writing (Original Screenplay),,Written by Courtney Hunt
Writing (Original Screenplay),,Written by Mike Leigh
Writing (Original Screenplay),,Written by Martin McDonagh
Writing (Original Screenplay),1.0,Written by Dustin Lance Black
Writing (Original Screenplay),,"Screenplay by Andrew Stanton, Jim Reardon; Original Story by Andrew Stanton, Pete Docter"
Jean Hersholt Humanitarian Award,1.0,
Gordon E. Sawyer Award,1.0,
John A. Bonner Medal of Commendation,1.0,
Actor in a Leading Role,1.0,Crazy Heart
Actor in a Leading Role,,Up in the Air
Actor in a Leading Role,,A Single Man
Actor in a Leading Role,,Invictus
Actor in a Leading Role,,The Hurt Locker
Actor in a Supporting Role,,Invictus
Actor in a Supporting Role,,The Messenger
Actor in a Supporting Role,,The Last Station
Actor in a Supporting Role,,The Lovely Bones
Actor in a Supporting Role,1.0,Inglourious Basterds
Actress in a Leading Role,1.0,The Blind Side
Actress in a Leading Role,,The Last Station
Actress in a Leading Role,,An Education
Actress in a Leading Role,,Precious: Based on the Novel 'Push' by Sapphire
Actress in a Leading Role,,Julie & Julia
Actress in a Supporting Role,,Nine
Actress in a Supporting Role,,Up in the Air
Actress in a Supporting Role,,Crazy Heart
Actress in a Supporting Role,,Up in the Air
Actress in a Supporting Role,1.0,Precious: Based on the Novel 'Push' by Sapphire
Animated Feature Film,,Henry Selick
Animated Feature Film,,Wes Anderson
Animated Feature Film,,John Musker and Ron Clements
Animated Feature Film,,Tomm Moore
Animated Feature Film,1.0,Pete Docter
Art Direction,1.0,Production Design: Rick Carter and Robert Stromberg; Set Decoration: Kim Sinclair
Art Direction,,Production Design: Dave Warren and Anastasia Masaro; Set Decoration: Caroline Smith
Art Direction,,Production Design: John Myhre; Set Decoration: Gordon Sim
Art Direction,,Production Design: Sarah Greenwood; Set Decoration: Katie Spencer
Art Direction,,Production Design: Patrice Vermette; Set Decoration: Maggie Gray
Cinematography,1.0,Mauro Fiore
Cinematography,,Bruno Delbonnel
Cinematography,,Barry Ackroyd
Cinematography,,Robert Richardson
Cinematography,,Christian Berger
Costume Design,,Janet Patterson
Costume Design,,Catherine Leterrier
Costume Design,,Monique Prudhomme
Costume Design,,Colleen Atwood
Costume Design,1.0,Sandy Powell
Directing,,James Cameron
Directing,1.0,Kathryn Bigelow
Directing,,Quentin Tarantino
Directing,,Lee Daniels
Directing,,Jason Reitman
Documentary (Feature),,Anders Østergaard and Lise Lense-Møller
Documentary (Feature),1.0,Louie Psihoyos and Fisher Stevens
Documentary (Feature),,Robert Kenner and Elise Pearlstein
Documentary (Feature),,Judith Ehrlich and Rick Goldsmith
Documentary (Feature),,Rebecca Cammisa
Documentary (Short Subject),,Jon Alpert and Matthew O'Neill
Documentary (Short Subject),,Daniel Junge and Henry Ansbacher
Documentary (Short Subject),,Steven Bognar and Julia Reichert
Documentary (Short Subject),1.0,Roger Ross Williams and Elinor Burkett
Documentary (Short Subject),,Bartek Konopka and Anna Wydra
Film Editing,,"Stephen Rivkin, John Refoua and James Cameron"
Film Editing,,Julian Clarke
Film Editing,1.0,Bob Murawski and Chris Innis
Film Editing,,Sally Menke
Film Editing,,Joe Klotz
Foreign Language Film,,Israel
Foreign Language Film,,Peru
Foreign Language Film,,France
Foreign Language Film,1.0,Argentina
Foreign Language Film,,Germany
Makeup,,Aldo Signoretti and Vittorio Sodano
Makeup,1.0,"Barney Burman, Mindy Hall and Joel Harlow"
